{
  "components": {
    "AtomParamsKitchenSink": {
      "childHierarchy": {
        "Root": [
          "Flag",
          "Glyph"
        ]
      },
      "childNodes": {
        "Flag": {
          "id": "Flag",
          "kind": "text",
          "props": {
            "color": "semantic:atoms.color.sem.fromRgb",
            "content": "param:label",
            "fontSize": 14,
            "fontWeight": 500
          }
        },
        "Glyph": {
          "id": "Glyph",
          "kind": "icon",
          "props": {
            "color": "primitive:atoms.color.rgba",
            "icon": "param:glyph",
            "size": 18
          }
        }
      },
      "defaultParams": {
        "count": "2",
        "density": "comfortable",
        "enabled": "true",
        "glyph": "{\"kind\":\"iconRef\",\"source\":\"system\",\"system\":\"sfSymbols\",\"name\":\"circle.fill\"}",
        "label": "Label"
      },
      "expose": [
        "label",
        "count",
        "enabled",
        "glyph",
        "density"
      ],
      "name": "AtomParamsKitchenSink",
      "params": [
        {
          "default": "Label",
          "name": "label",
          "type": "String"
        },
        {
          "default": 2,
          "name": "count",
          "type": "Number"
        },
        {
          "default": true,
          "name": "enabled",
          "type": "Boolean"
        },
        {
          "default": {
            "kind": "iconRef",
            "name": "circle.fill",
            "source": "system",
            "system": "sfSymbols"
          },
          "name": "glyph",
          "type": "Icon"
        },
        {
          "default": "comfortable",
          "name": "density",
          "type": "variant",
          "variantTypeName": "AtomsDensity"
        }
      ],
      "root": {
        "kind": "layout",
        "props": {
          "direction": "column",
          "gap": "primitive:atoms.space.sm",
          "padding": {
            "bottom": 8,
            "left": 16,
            "right": 16,
            "top": 8
          }
        }
      }
    }
  },
  "generatedAt": "2026-08-06T00:33:35.813Z",
  "kind": "componentCatalogue",
  "primitives": {
    "atoms.color.brandPrimary": {
      "definition": {
        "kind": "hex",
        "value": "#FF5A5F"
      },
      "name": "atoms.color.brandPrimary",
      "tokenType": "Color"
    },
    "atoms.color.brandSecondary": {
      "definition": {
        "kind": "hex",
        "value": "#00A699"
      },
      "name": "atoms.color.brandSecondary",
      "tokenType": "Color"
    },
    "atoms.color.canvas": {
      "definition": {
        "kind": "hex",
        "value": "#F7F7F7"
      },
      "name": "atoms.color.canvas",
      "tokenType": "Color"
    },
    "atoms.color.elevated": {
      "definition": {
        "kind": "hex",
        "value": "#EBEBEB"
      },
      "name": "atoms.color.elevated",
      "tokenType": "Color"
    },
    "atoms.color.rgb": {
      "definition": {
        "kind": "hex",
        "value": "#D3D3D3"
      },
      "name": "atoms.color.rgb",
      "tokenType": "Color"
    },
    "atoms.color.rgba": {
      "definition": {
        "kind": "hex",
        "value": "#222222"
      },
      "name": "atoms.color.rgba",
      "tokenType": "Color"
    },
    "atoms.color.textMuted": {
      "definition": {
        "kind": "hex",
        "value": "#717171"
      },
      "name": "atoms.color.textMuted",
      "tokenType": "Color"
    },
    "atoms.color.textOnBrand": {
      "definition": {
        "kind": "hex",
        "value": "#FFFFFF"
      },
      "name": "atoms.color.textOnBrand",
      "tokenType": "Color"
    },
    "atoms.color.textPrimary": {
      "definition": {
        "kind": "hex",
        "value": "#222222"
      },
      "name": "atoms.color.textPrimary",
      "tokenType": "Color"
    },
    "atoms.radius.md": {
      "definition": {
        "kind": "number",
        "value": 8
      },
      "name": "atoms.radius.md",
      "tokenType": "Radius"
    },
    "atoms.radius.sm": {
      "definition": {
        "kind": "number",
        "value": 4
      },
      "name": "atoms.radius.sm",
      "tokenType": "Radius"
    },
    "atoms.space.md": {
      "definition": {
        "kind": "number",
        "value": 16
      },
      "name": "atoms.space.md",
      "tokenType": "Distance"
    },
    "atoms.space.sm": {
      "definition": {
        "kind": "number",
        "value": 8
      },
      "name": "atoms.space.sm",
      "tokenType": "Distance"
    },
    "atoms.space.xs": {
      "definition": {
        "kind": "number",
        "value": 4
      },
      "name": "atoms.space.xs",
      "tokenType": "Distance"
    }
  },
  "schemaVersion": "1.0.0-beta",
  "semantics": {
    "atoms.color.scrimLiteral": {
      "definition": {
        "base": "primitive:atoms.color.rgb",
        "kind": "opacityOf",
        "opacity": {
          "kind": "number",
          "value": 0.25
        }
      },
      "name": "atoms.color.scrimLiteral",
      "tokenType": "Color"
    },
    "atoms.color.scrimRgba": {
      "definition": {
        "base": "primitive:atoms.color.rgba",
        "kind": "opacityOf",
        "opacity": {
          "kind": "number",
          "value": 0.5
        }
      },
      "name": "atoms.color.scrimRgba",
      "tokenType": "Color"
    },
    "atoms.color.sem.fromRgb": {
      "definition": "primitive:atoms.color.canvas",
      "name": "atoms.color.sem.fromRgb",
      "tokenType": "Color"
    },
    "atoms.color.sem.fromRgba": {
      "definition": "primitive:atoms.color.elevated",
      "name": "atoms.color.sem.fromRgba",
      "tokenType": "Color"
    },
    "atoms.radius.card": {
      "definition": "primitive:atoms.radius.md",
      "name": "atoms.radius.card",
      "tokenType": "Radius"
    },
    "atoms.space.card.pad": {
      "definition": "primitive:atoms.space.md",
      "name": "atoms.space.card.pad",
      "tokenType": "Distance"
    }
  },
  "variantTypes": {
    "AtomsAxis": {
      "cases": [
        "horizontal",
        "vertical"
      ],
      "name": "AtomsAxis"
    },
    "AtomsDensity": {
      "cases": [
        "comfortable",
        "compact"
      ],
      "name": "AtomsDensity"
    },
    "AtomsPhase": {
      "cases": [
        "rest",
        "hovered",
        "pressed"
      ],
      "name": "AtomsPhase"
    },
    "AtomsSize": {
      "cases": [
        "sm",
        "md",
        "lg"
      ],
      "name": "AtomsSize"
    },
    "AtomsTone": {
      "cases": [
        "neutral",
        "accent",
        "danger"
      ],
      "name": "AtomsTone"
    }
  }
}
