{
  "components": {
    "Greeting": {
      "childHierarchy": {
        "Root": [
          "Title"
        ]
      },
      "childNodes": {
        "Title": {
          "id": "Title",
          "kind": "text",
          "props": {
            "content": "param:title"
          }
        }
      },
      "defaultParams": {
        "title": "Hello"
      },
      "expose": [
        "title"
      ],
      "name": "Greeting",
      "params": [
        {
          "default": "Hello",
          "name": "title",
          "type": "String"
        }
      ],
      "root": {
        "kind": "layout",
        "props": {
          "direction": "column",
          "padding": {
            "bottom": 16,
            "left": 16,
            "right": 16,
            "top": 16
          }
        }
      }
    }
  },
  "generatedAt": "2026-08-06T01:16:45.925Z",
  "kind": "componentCatalogue",
  "schemaVersion": "1.0.0-beta"
}
