{
  "components": {
    "AtomHiddenFrame": {
      "childHierarchy": {
        "B": [
          "Inner"
        ],
        "Root": [
          "A",
          "B"
        ]
      },
      "childNodes": {
        "A": {
          "id": "A",
          "kind": "text",
          "props": {
            "content": "Always",
            "typeStyle": "typeStyle:AtomCaption"
          }
        },
        "B": {
          "id": "B",
          "kind": "layout",
          "props": {
            "direction": "row"
          }
        },
        "Inner": {
          "id": "Inner",
          "kind": "text",
          "props": {
            "content": "Sometimes",
            "typeStyle": "typeStyle:AtomBody"
          }
        }
      },
      "defaultParams": {
        "mode": "showExtra"
      },
      "expose": [
        "mode"
      ],
      "name": "AtomHiddenFrame",
      "params": [
        {
          "default": "showExtra",
          "name": "mode",
          "type": "variant",
          "variantTypeName": "AtomHiddenFrameMode"
        }
      ],
      "root": {
        "kind": "layout",
        "props": {
          "direction": "column"
        }
      },
      "variants": [
        {
          "affectedFrames": [
            "A",
            "B",
            "Root"
          ],
          "changes": [
            {
              "frameId": "B",
              "prop": "hidden",
              "value": true
            }
          ],
          "childHierarchy": {
            "B": [
              "Inner"
            ],
            "Root": [
              "A"
            ]
          },
          "params": {
            "mode": "hideExtra"
          },
          "structuralChange": true
        }
      ]
    }
  },
  "generatedAt": "2026-08-06T00:33:36.042Z",
  "kind": "componentCatalogue",
  "primitives": {
    "atoms.color.brandPrimary": {
      "definition": {
        "kind": "hex",
        "value": "#FF5A5F"
      },
      "name": "atoms.color.brandPrimary",
      "tokenType": "Color"
    },
    "atoms.color.brandSecondary": {
      "definition": {
        "kind": "hex",
        "value": "#00A699"
      },
      "name": "atoms.color.brandSecondary",
      "tokenType": "Color"
    },
    "atoms.color.canvas": {
      "definition": {
        "kind": "hex",
        "value": "#F7F7F7"
      },
      "name": "atoms.color.canvas",
      "tokenType": "Color"
    },
    "atoms.color.elevated": {
      "definition": {
        "kind": "hex",
        "value": "#EBEBEB"
      },
      "name": "atoms.color.elevated",
      "tokenType": "Color"
    },
    "atoms.color.rgb": {
      "definition": {
        "kind": "hex",
        "value": "#D3D3D3"
      },
      "name": "atoms.color.rgb",
      "tokenType": "Color"
    },
    "atoms.color.rgba": {
      "definition": {
        "kind": "hex",
        "value": "#222222"
      },
      "name": "atoms.color.rgba",
      "tokenType": "Color"
    },
    "atoms.color.textMuted": {
      "definition": {
        "kind": "hex",
        "value": "#717171"
      },
      "name": "atoms.color.textMuted",
      "tokenType": "Color"
    },
    "atoms.color.textOnBrand": {
      "definition": {
        "kind": "hex",
        "value": "#FFFFFF"
      },
      "name": "atoms.color.textOnBrand",
      "tokenType": "Color"
    },
    "atoms.color.textPrimary": {
      "definition": {
        "kind": "hex",
        "value": "#222222"
      },
      "name": "atoms.color.textPrimary",
      "tokenType": "Color"
    },
    "atoms.font.mono": {
      "definition": {
        "kind": "string",
        "value": "ui-monospace, monospace"
      },
      "name": "atoms.font.mono",
      "tokenType": "FontFamily"
    },
    "atoms.font.ui": {
      "definition": {
        "kind": "string",
        "value": "system-ui, sans-serif"
      },
      "name": "atoms.font.ui",
      "tokenType": "FontFamily"
    },
    "atoms.type.size.body": {
      "definition": {
        "kind": "number",
        "value": 16
      },
      "name": "atoms.type.size.body",
      "tokenType": "Size"
    },
    "atoms.type.size.caption": {
      "definition": {
        "kind": "number",
        "value": 12
      },
      "name": "atoms.type.size.caption",
      "tokenType": "Size"
    },
    "atoms.type.size.title": {
      "definition": {
        "kind": "number",
        "value": 22
      },
      "name": "atoms.type.size.title",
      "tokenType": "Size"
    },
    "atoms.type.weight.bold": {
      "definition": {
        "kind": "number",
        "value": 700
      },
      "name": "atoms.type.weight.bold",
      "tokenType": "Weight"
    },
    "atoms.type.weight.medium": {
      "definition": {
        "kind": "number",
        "value": 600
      },
      "name": "atoms.type.weight.medium",
      "tokenType": "Weight"
    },
    "atoms.type.weight.regular": {
      "definition": {
        "kind": "number",
        "value": 400
      },
      "name": "atoms.type.weight.regular",
      "tokenType": "Weight"
    }
  },
  "schemaVersion": "1.0.0-beta",
  "semantics": {
    "atoms.color.scrimLiteral": {
      "definition": {
        "base": "primitive:atoms.color.rgb",
        "kind": "opacityOf",
        "opacity": {
          "kind": "number",
          "value": 0.25
        }
      },
      "name": "atoms.color.scrimLiteral",
      "tokenType": "Color"
    },
    "atoms.color.scrimRgba": {
      "definition": {
        "base": "primitive:atoms.color.rgba",
        "kind": "opacityOf",
        "opacity": {
          "kind": "number",
          "value": 0.5
        }
      },
      "name": "atoms.color.scrimRgba",
      "tokenType": "Color"
    },
    "atoms.color.sem.fromRgb": {
      "definition": "primitive:atoms.color.canvas",
      "name": "atoms.color.sem.fromRgb",
      "tokenType": "Color"
    },
    "atoms.color.sem.fromRgba": {
      "definition": "primitive:atoms.color.elevated",
      "name": "atoms.color.sem.fromRgba",
      "tokenType": "Color"
    }
  },
  "typeStyles": {
    "AtomBody": {
      "name": "AtomBody",
      "props": {
        "color": "primitive:atoms.color.textPrimary",
        "fontFamily": "primitive:atoms.font.ui",
        "fontSize": "primitive:atoms.type.size.body",
        "fontWeight": "primitive:atoms.type.weight.regular"
      }
    },
    "AtomCaption": {
      "name": "AtomCaption",
      "props": {
        "color": "primitive:atoms.color.textMuted",
        "fontFamily": "primitive:atoms.font.ui",
        "fontSize": "primitive:atoms.type.size.caption",
        "fontWeight": "primitive:atoms.type.weight.medium"
      }
    },
    "AtomMono": {
      "name": "AtomMono",
      "props": {
        "color": "primitive:atoms.color.textPrimary",
        "fontFamily": "primitive:atoms.font.mono",
        "fontSize": "primitive:atoms.type.size.caption",
        "fontWeight": "primitive:atoms.type.weight.regular"
      }
    },
    "AtomTitle": {
      "name": "AtomTitle",
      "props": {
        "color": "primitive:atoms.color.textPrimary",
        "fontFamily": "primitive:atoms.font.ui",
        "fontSize": "primitive:atoms.type.size.title",
        "fontWeight": "primitive:atoms.type.weight.bold"
      }
    }
  },
  "variantTypes": {
    "AtomHiddenFrameMode": {
      "cases": [
        "showExtra",
        "hideExtra"
      ],
      "name": "AtomHiddenFrameMode"
    }
  }
}
