{
  "components": {
    "AtomExposedCard": {
      "childHierarchy": {
        "Root": [
          "T",
          "S"
        ]
      },
      "childNodes": {
        "S": {
          "id": "S",
          "kind": "text",
          "props": {
            "color": "primitive:atoms.color.rgba",
            "content": "param:subtitle",
            "fontSize": 12
          }
        },
        "T": {
          "id": "T",
          "kind": "text",
          "props": {
            "color": "semantic:atoms.color.sem.fromRgba",
            "content": "param:title",
            "fontSize": 18,
            "fontWeight": 600
          }
        }
      },
      "defaultParams": {
        "showBorder": "false",
        "subtitle": "Subtitle",
        "title": "Card"
      },
      "expose": [
        "title",
        "subtitle",
        "showBorder"
      ],
      "name": "AtomExposedCard",
      "params": [
        {
          "default": "Card",
          "name": "title",
          "type": "String"
        },
        {
          "default": "Subtitle",
          "name": "subtitle",
          "type": "String"
        },
        {
          "default": false,
          "name": "showBorder",
          "type": "Bool"
        }
      ],
      "root": {
        "kind": "layout",
        "props": {
          "background": "semantic:atoms.color.sem.fromRgb",
          "direction": "column",
          "gap": "primitive:atoms.space.xs",
          "padding": {
            "bottom": 8,
            "left": 16,
            "right": 16,
            "top": 8
          }
        }
      }
    }
  },
  "generatedAt": "2026-08-06T00:33:35.998Z",
  "kind": "componentCatalogue",
  "primitives": {
    "atoms.color.brandPrimary": {
      "definition": {
        "kind": "hex",
        "value": "#FF5A5F"
      },
      "name": "atoms.color.brandPrimary",
      "tokenType": "Color"
    },
    "atoms.color.brandSecondary": {
      "definition": {
        "kind": "hex",
        "value": "#00A699"
      },
      "name": "atoms.color.brandSecondary",
      "tokenType": "Color"
    },
    "atoms.color.canvas": {
      "definition": {
        "kind": "hex",
        "value": "#F7F7F7"
      },
      "name": "atoms.color.canvas",
      "tokenType": "Color"
    },
    "atoms.color.elevated": {
      "definition": {
        "kind": "hex",
        "value": "#EBEBEB"
      },
      "name": "atoms.color.elevated",
      "tokenType": "Color"
    },
    "atoms.color.rgb": {
      "definition": {
        "kind": "hex",
        "value": "#D3D3D3"
      },
      "name": "atoms.color.rgb",
      "tokenType": "Color"
    },
    "atoms.color.rgba": {
      "definition": {
        "kind": "hex",
        "value": "#222222"
      },
      "name": "atoms.color.rgba",
      "tokenType": "Color"
    },
    "atoms.color.textMuted": {
      "definition": {
        "kind": "hex",
        "value": "#717171"
      },
      "name": "atoms.color.textMuted",
      "tokenType": "Color"
    },
    "atoms.color.textOnBrand": {
      "definition": {
        "kind": "hex",
        "value": "#FFFFFF"
      },
      "name": "atoms.color.textOnBrand",
      "tokenType": "Color"
    },
    "atoms.color.textPrimary": {
      "definition": {
        "kind": "hex",
        "value": "#222222"
      },
      "name": "atoms.color.textPrimary",
      "tokenType": "Color"
    },
    "atoms.radius.md": {
      "definition": {
        "kind": "number",
        "value": 8
      },
      "name": "atoms.radius.md",
      "tokenType": "Radius"
    },
    "atoms.radius.sm": {
      "definition": {
        "kind": "number",
        "value": 4
      },
      "name": "atoms.radius.sm",
      "tokenType": "Radius"
    },
    "atoms.space.md": {
      "definition": {
        "kind": "number",
        "value": 16
      },
      "name": "atoms.space.md",
      "tokenType": "Distance"
    },
    "atoms.space.sm": {
      "definition": {
        "kind": "number",
        "value": 8
      },
      "name": "atoms.space.sm",
      "tokenType": "Distance"
    },
    "atoms.space.xs": {
      "definition": {
        "kind": "number",
        "value": 4
      },
      "name": "atoms.space.xs",
      "tokenType": "Distance"
    }
  },
  "schemaVersion": "1.0.0-beta",
  "semantics": {
    "atoms.color.scrimLiteral": {
      "definition": {
        "base": "primitive:atoms.color.rgb",
        "kind": "opacityOf",
        "opacity": {
          "kind": "number",
          "value": 0.25
        }
      },
      "name": "atoms.color.scrimLiteral",
      "tokenType": "Color"
    },
    "atoms.color.scrimRgba": {
      "definition": {
        "base": "primitive:atoms.color.rgba",
        "kind": "opacityOf",
        "opacity": {
          "kind": "number",
          "value": 0.5
        }
      },
      "name": "atoms.color.scrimRgba",
      "tokenType": "Color"
    },
    "atoms.color.sem.fromRgb": {
      "definition": "primitive:atoms.color.canvas",
      "name": "atoms.color.sem.fromRgb",
      "tokenType": "Color"
    },
    "atoms.color.sem.fromRgba": {
      "definition": "primitive:atoms.color.elevated",
      "name": "atoms.color.sem.fromRgba",
      "tokenType": "Color"
    },
    "atoms.radius.card": {
      "definition": "primitive:atoms.radius.md",
      "name": "atoms.radius.card",
      "tokenType": "Radius"
    },
    "atoms.space.card.pad": {
      "definition": "primitive:atoms.space.md",
      "name": "atoms.space.card.pad",
      "tokenType": "Distance"
    }
  }
}
