{
  "components": {
    "AtomFlexChildAbsolute": {
      "childHierarchy": {
        "Root": [
          "Floated"
        ]
      },
      "childNodes": {
        "Floated": {
          "id": "Floated",
          "kind": "layout",
          "props": {
            "alignSelf": "auto",
            "background": "primitive:atoms.color.rgb",
            "direction": "column",
            "inset": {
              "bottom": 4,
              "left": 4,
              "right": 4,
              "top": 4
            },
            "position": "absolute"
          }
        }
      },
      "name": "AtomFlexChildAbsolute",
      "root": {
        "kind": "layout",
        "props": {
          "align": "start",
          "background": "semantic:atoms.color.sem.fromRgb",
          "direction": "row",
          "justify": "start",
          "padding": {
            "bottom": 16,
            "left": 16,
            "right": 16,
            "top": 16
          },
          "wrap": "nowrap"
        }
      }
    },
    "AtomFlexChildGrow": {
      "childHierarchy": {
        "Root": [
          "A",
          "B"
        ]
      },
      "childNodes": {
        "A": {
          "id": "A",
          "kind": "layout",
          "props": {
            "alignSelf": "stretch",
            "background": "primitive:atoms.color.rgba",
            "direction": "column",
            "grow": 1,
            "shrink": 1
          }
        },
        "B": {
          "id": "B",
          "kind": "layout",
          "props": {
            "alignSelf": "end",
            "background": "semantic:atoms.color.sem.fromRgba",
            "direction": "column",
            "grow": 0,
            "shrink": 0
          }
        }
      },
      "name": "AtomFlexChildGrow",
      "root": {
        "kind": "layout",
        "props": {
          "align": "stretch",
          "background": "semantic:atoms.color.sem.fromRgb",
          "direction": "row",
          "gap": "primitive:atoms.space.sm",
          "justify": "start",
          "wrap": "nowrap"
        }
      }
    }
  },
  "generatedAt": "2026-08-06T00:33:36.174Z",
  "kind": "componentCatalogue",
  "primitives": {
    "atoms.color.brandPrimary": {
      "definition": {
        "kind": "hex",
        "value": "#FF5A5F"
      },
      "name": "atoms.color.brandPrimary",
      "tokenType": "Color"
    },
    "atoms.color.brandSecondary": {
      "definition": {
        "kind": "hex",
        "value": "#00A699"
      },
      "name": "atoms.color.brandSecondary",
      "tokenType": "Color"
    },
    "atoms.color.canvas": {
      "definition": {
        "kind": "hex",
        "value": "#F7F7F7"
      },
      "name": "atoms.color.canvas",
      "tokenType": "Color"
    },
    "atoms.color.elevated": {
      "definition": {
        "kind": "hex",
        "value": "#EBEBEB"
      },
      "name": "atoms.color.elevated",
      "tokenType": "Color"
    },
    "atoms.color.rgb": {
      "definition": {
        "kind": "hex",
        "value": "#D3D3D3"
      },
      "name": "atoms.color.rgb",
      "tokenType": "Color"
    },
    "atoms.color.rgba": {
      "definition": {
        "kind": "hex",
        "value": "#222222"
      },
      "name": "atoms.color.rgba",
      "tokenType": "Color"
    },
    "atoms.color.textMuted": {
      "definition": {
        "kind": "hex",
        "value": "#717171"
      },
      "name": "atoms.color.textMuted",
      "tokenType": "Color"
    },
    "atoms.color.textOnBrand": {
      "definition": {
        "kind": "hex",
        "value": "#FFFFFF"
      },
      "name": "atoms.color.textOnBrand",
      "tokenType": "Color"
    },
    "atoms.color.textPrimary": {
      "definition": {
        "kind": "hex",
        "value": "#222222"
      },
      "name": "atoms.color.textPrimary",
      "tokenType": "Color"
    },
    "atoms.radius.mixed": {
      "definition": {
        "bl": {
          "kind": "number",
          "value": 2
        },
        "br": {
          "kind": "number",
          "value": 2
        },
        "kind": "corner",
        "tl": {
          "kind": "number",
          "value": 8
        },
        "tr": {
          "kind": "number",
          "value": 8
        }
      },
      "name": "atoms.radius.mixed",
      "tokenType": "Radius"
    },
    "atoms.radius.sm": {
      "definition": {
        "kind": "number",
        "value": 4
      },
      "name": "atoms.radius.sm",
      "tokenType": "Radius"
    },
    "atoms.space.md": {
      "definition": {
        "kind": "number",
        "value": 16
      },
      "name": "atoms.space.md",
      "tokenType": "Distance"
    },
    "atoms.space.sm": {
      "definition": {
        "kind": "number",
        "value": 8
      },
      "name": "atoms.space.sm",
      "tokenType": "Distance"
    },
    "atoms.space.xs": {
      "definition": {
        "kind": "number",
        "value": 4
      },
      "name": "atoms.space.xs",
      "tokenType": "Distance"
    }
  },
  "schemaVersion": "1.0.0-beta",
  "semantics": {
    "atoms.color.scrimLiteral": {
      "definition": {
        "base": "primitive:atoms.color.rgb",
        "kind": "opacityOf",
        "opacity": {
          "kind": "number",
          "value": 0.25
        }
      },
      "name": "atoms.color.scrimLiteral",
      "tokenType": "Color"
    },
    "atoms.color.scrimRgba": {
      "definition": {
        "base": "primitive:atoms.color.rgba",
        "kind": "opacityOf",
        "opacity": {
          "kind": "number",
          "value": 0.5
        }
      },
      "name": "atoms.color.scrimRgba",
      "tokenType": "Color"
    },
    "atoms.color.sem.fromRgb": {
      "definition": "primitive:atoms.color.canvas",
      "name": "atoms.color.sem.fromRgb",
      "tokenType": "Color"
    },
    "atoms.color.sem.fromRgba": {
      "definition": "primitive:atoms.color.elevated",
      "name": "atoms.color.sem.fromRgba",
      "tokenType": "Color"
    },
    "atoms.radius.card": {
      "definition": "primitive:atoms.radius.mixed",
      "name": "atoms.radius.card",
      "tokenType": "Radius"
    },
    "atoms.space.card.pad": {
      "definition": "primitive:atoms.space.md",
      "name": "atoms.space.card.pad",
      "tokenType": "Distance"
    }
  }
}
