{
  "components": {
    "AtomMediaContainCorners": {
      "childHierarchy": {
        "Root": [
          "M"
        ]
      },
      "childNodes": {
        "M": {
          "id": "M",
          "kind": "media",
          "props": {
            "background": "primitive:atoms.color.rgb",
            "contentMode": "contain",
            "height": {
              "fixed": 180
            },
            "objectPosition": "topLeft",
            "source": "https://example.com/poster.jpg",
            "width": "fill"
          }
        }
      },
      "name": "AtomMediaContainCorners",
      "root": {
        "kind": "layout",
        "props": {
          "background": "semantic:atoms.color.sem.fromRgba",
          "direction": "column"
        }
      }
    },
    "AtomMediaCover": {
      "childHierarchy": {
        "Root": [
          "M"
        ]
      },
      "childNodes": {
        "M": {
          "id": "M",
          "kind": "media",
          "props": {
            "aspectRatio": "primitive:atoms.ratio.video",
            "contentMode": "cover",
            "cornerRadius": "primitive:atoms.radius.sm",
            "objectPosition": "center",
            "source": "primitive:atoms.media.hero"
          }
        }
      },
      "name": "AtomMediaCover",
      "root": {
        "kind": "layout",
        "props": {
          "background": "semantic:atoms.color.sem.fromRgb",
          "direction": "column"
        }
      }
    },
    "AtomMediaScaleDown": {
      "childHierarchy": {
        "Root": [
          "M"
        ]
      },
      "childNodes": {
        "M": {
          "id": "M",
          "kind": "media",
          "props": {
            "contentMode": "scaleDown",
            "objectPosition": "bottomRight",
            "opacity": 0.92,
            "source": "asset://local.png"
          }
        }
      },
      "name": "AtomMediaScaleDown",
      "root": {
        "kind": "layout",
        "props": {
          "background": "primitive:atoms.color.rgba",
          "direction": "column"
        }
      }
    }
  },
  "generatedAt": "2026-08-06T00:33:36.216Z",
  "kind": "componentCatalogue",
  "primitives": {
    "atoms.color.brandPrimary": {
      "definition": {
        "kind": "hex",
        "value": "#FF5A5F"
      },
      "name": "atoms.color.brandPrimary",
      "tokenType": "Color"
    },
    "atoms.color.brandSecondary": {
      "definition": {
        "kind": "hex",
        "value": "#00A699"
      },
      "name": "atoms.color.brandSecondary",
      "tokenType": "Color"
    },
    "atoms.color.canvas": {
      "definition": {
        "kind": "hex",
        "value": "#F7F7F7"
      },
      "name": "atoms.color.canvas",
      "tokenType": "Color"
    },
    "atoms.color.elevated": {
      "definition": {
        "kind": "hex",
        "value": "#EBEBEB"
      },
      "name": "atoms.color.elevated",
      "tokenType": "Color"
    },
    "atoms.color.rgb": {
      "definition": {
        "kind": "hex",
        "value": "#D3D3D3"
      },
      "name": "atoms.color.rgb",
      "tokenType": "Color"
    },
    "atoms.color.rgba": {
      "definition": {
        "kind": "hex",
        "value": "#222222"
      },
      "name": "atoms.color.rgba",
      "tokenType": "Color"
    },
    "atoms.color.textMuted": {
      "definition": {
        "kind": "hex",
        "value": "#717171"
      },
      "name": "atoms.color.textMuted",
      "tokenType": "Color"
    },
    "atoms.color.textOnBrand": {
      "definition": {
        "kind": "hex",
        "value": "#FFFFFF"
      },
      "name": "atoms.color.textOnBrand",
      "tokenType": "Color"
    },
    "atoms.color.textPrimary": {
      "definition": {
        "kind": "hex",
        "value": "#222222"
      },
      "name": "atoms.color.textPrimary",
      "tokenType": "Color"
    },
    "atoms.icon.chevron": {
      "definition": {
        "kind": "string",
        "value": "chevron-right"
      },
      "name": "atoms.icon.chevron",
      "tokenType": "Icon"
    },
    "atoms.icon.star": {
      "definition": {
        "kind": "string",
        "value": "star"
      },
      "name": "atoms.icon.star",
      "tokenType": "Icon"
    },
    "atoms.media.hero": {
      "definition": {
        "kind": "string",
        "value": "https://example.com/hero.png"
      },
      "name": "atoms.media.hero",
      "tokenType": "MediaSource"
    },
    "atoms.radius.md": {
      "definition": {
        "kind": "number",
        "value": 8
      },
      "name": "atoms.radius.md",
      "tokenType": "Radius"
    },
    "atoms.radius.sm": {
      "definition": {
        "kind": "number",
        "value": 4
      },
      "name": "atoms.radius.sm",
      "tokenType": "Radius"
    },
    "atoms.ratio.photo": {
      "definition": {
        "height": 3,
        "kind": "ratio",
        "width": 4
      },
      "name": "atoms.ratio.photo",
      "tokenType": "Ratio"
    },
    "atoms.ratio.square": {
      "definition": {
        "kind": "number",
        "value": 1
      },
      "name": "atoms.ratio.square",
      "tokenType": "Ratio"
    },
    "atoms.ratio.video": {
      "definition": {
        "height": 9,
        "kind": "ratio",
        "width": 16
      },
      "name": "atoms.ratio.video",
      "tokenType": "Ratio"
    },
    "atoms.space.md": {
      "definition": {
        "kind": "number",
        "value": 16
      },
      "name": "atoms.space.md",
      "tokenType": "Distance"
    },
    "atoms.space.sm": {
      "definition": {
        "kind": "number",
        "value": 8
      },
      "name": "atoms.space.sm",
      "tokenType": "Distance"
    },
    "atoms.space.xs": {
      "definition": {
        "kind": "number",
        "value": 4
      },
      "name": "atoms.space.xs",
      "tokenType": "Distance"
    }
  },
  "schemaVersion": "1.0.0-beta",
  "semantics": {
    "atoms.color.scrimLiteral": {
      "definition": {
        "base": "primitive:atoms.color.rgb",
        "kind": "opacityOf",
        "opacity": {
          "kind": "number",
          "value": 0.25
        }
      },
      "name": "atoms.color.scrimLiteral",
      "tokenType": "Color"
    },
    "atoms.color.scrimRgba": {
      "definition": {
        "base": "primitive:atoms.color.rgba",
        "kind": "opacityOf",
        "opacity": {
          "kind": "number",
          "value": 0.5
        }
      },
      "name": "atoms.color.scrimRgba",
      "tokenType": "Color"
    },
    "atoms.color.sem.fromRgb": {
      "definition": "primitive:atoms.color.canvas",
      "name": "atoms.color.sem.fromRgb",
      "tokenType": "Color"
    },
    "atoms.color.sem.fromRgba": {
      "definition": "primitive:atoms.color.elevated",
      "name": "atoms.color.sem.fromRgba",
      "tokenType": "Color"
    },
    "atoms.radius.card": {
      "definition": "primitive:atoms.radius.md",
      "name": "atoms.radius.card",
      "tokenType": "Radius"
    },
    "atoms.space.card.pad": {
      "definition": "primitive:atoms.space.md",
      "name": "atoms.space.card.pad",
      "tokenType": "Distance"
    }
  }
}
